{
  "$schema": "https://github.com/MarkEdit-app/extensions/raw/refs/heads/main/schemas/extension.schema.json",
  "id": "markedit-typlog",
  "name": "Typlog Publisher",
  "description": "Create and update Typlog drafts from Markdown, with local image uploads, captions, tags, and author selection.",
  "author": "haohailong",
  "homepage": "https://github.com/haohailong/markedit-typlog",
  "versions": [
    {
      "version": "0.3.8",
      "url": "https://github.com/haohailong/markedit-typlog/releases/download/v0.3.8/markedit-typlog.js",
      "sha256": "38583ed0ece837e97a4ca062e1bba67bec87baa27136e3fa72f877bd9989126d",
      "minAppVersion": "1.36.0",
      "notes": "Initial registry release with direct image uploads, reusable draft associations, confirmed recovery for missing drafts, and optional local Token encryption."
    }
  ]
}
