{
  "$schema": "https://github.com/MarkEdit-app/extensions/raw/refs/heads/main/schemas/extension.schema.json",
  "id": "markedit-theme-zero",
  "name": "Theme Zero",
  "description": "A blank theme to start building your own colors.",
  "author": "MarkEdit-app",
  "homepage": "https://github.com/MarkEdit-app/MarkEdit-theme-zero",
  "versions": [
    {
      "version": "1.1.0",
      "url": "https://raw.githubusercontent.com/MarkEdit-app/MarkEdit-theme-zero/v1.1.0/dist/markedit-theme-zero.js",
      "sha256": "70b6d8eda20c3a4bfa7527f8052d7fb3ebcdab8b45261065527861a5efafb4b3"
    },
    {
      "version": "1.0.0",
      "url": "https://raw.githubusercontent.com/MarkEdit-app/MarkEdit-theme-zero/v1.0.0/dist/markedit-theme-zero.js",
      "sha256": "f97a85c385c87ca6d05333df53df80a2761ed44ff8a1848ef7bbe6e5efcec0d7"
    }
  ]
}
